{
  "id": "payments-platform-2026-q3",
  "team": "payments-platform",
  "cycle": "2026-Q3",
  "period": {
    "start": "2026-07-01",
    "end": "2026-09-30"
  },
  "risks": ["usability", "feasibility"],
  "dimensions": [
    "shared-tooling",
    "cross-functional-ownership",
    "experiment-velocity",
    "delivery-autonomy",
    "impact-learning"
  ],
  "scores": {
    "shared-tooling": 4,
    "cross-functional-ownership": 4,
    "experiment-velocity": 3,
    "delivery-autonomy": 4,
    "impact-learning": 3
  },
  "notes": "The team has started reusing prompts and working prototypes, but still records outcomes unevenly.",
  "activeExperiments": ["prototype-first-discovery"],
  "observedMovement": "Shared tooling and delivery autonomy improved versus the previous cycle."
}
